<?xml version="1.0" encoding="UTF-8"?>
<lcMacros xmlns="http://www.bidib.org/jbidibc/lcmacro" xmlns:xsi="http://www.w3.org/2001/XMLSchema-instance" xsi:schemaLocation="xsd/macros.xsd ">
    <lcMacro macroName="TestMacro1" macroId="1" repeat="1" slowdown="1">
        <startClk weekday="TUESDAY" hour="23" minute="59"/>
        <lcMacroPoint xsi:type="LightPortPoint">
            <delay>6</delay>
            <LightPortActionType>ON</LightPortActionType>
            <outputNumber>0</outputNumber>
        </lcMacroPoint>
        <lcMacroPoint xsi:type="LightPortPoint">
            <delay>6</delay>
            <LightPortActionType>OFF</LightPortActionType>
            <outputNumber>0</outputNumber>
        </lcMacroPoint>
        <lcMacroPoint xsi:type="ServoPortPoint">
            <delay>60</delay>
            <ServoPortActionType>
                <action>START</action>
                <destination>230</destination>
            </ServoPortActionType>
            <outputNumber>0</outputNumber>
        </lcMacroPoint>
        <lcMacroPoint xsi:type="AnalogPortPoint">
            <delay>30</delay>
            <AnalogPortActionType>
                <action>START</action>
                <value>250</value>
            </AnalogPortActionType>
            <outputNumber>0</outputNumber>
        </lcMacroPoint>
        <lcMacroPoint xsi:type="FlagPoint">
            <FlagActionType>
                <operation>SET</operation>
                <flagNumber>12</flagNumber>
            </FlagActionType>
        </lcMacroPoint>
        <lcMacroPoint xsi:type="BacklightPortPoint">
            <delay>60</delay>
            <BacklightPortActionType>
                <action>START</action>
                <brightness>230</brightness>
            </BacklightPortActionType>
            <outputNumber>0</outputNumber>
        </lcMacroPoint>
        <lcMacroPoint xsi:type="AccessoryOkayPoint">
            <delay>65</delay>
            <AccessoryOkayActionType>NO_FEEDBACK</AccessoryOkayActionType>
        </lcMacroPoint>
        <lcMacroPoint xsi:type="AccessoryOkayPoint">
            <delay>65</delay>
            <AccessoryOkayActionType>QUERY0</AccessoryOkayActionType>
            <inputNumber>1</inputNumber>
        </lcMacroPoint>
        <lcMacroPoint xsi:type="AccessoryOkayPoint">
            <delay>65</delay>
            <AccessoryOkayActionType>QUERY1</AccessoryOkayActionType>
            <inputNumber>1</inputNumber>
        </lcMacroPoint>
    </lcMacro>
</lcMacros>
